{
  "schemaVersion": "1.0",
  "station": {
    "id": "future-garage",
    "name": "Future Garage"
  },
  "generatedAt": "2026-10-17T11:14:45.704Z",
  "baseUrl": "https://pub-777099b62b81412b8fa3b8a9046ae7ce.r2.dev/future-garage",
  "tracks": [
    {
      "id": "ac7d120963905893",
      "title": null,
      "artist": null,
      "filename": "future-garage-0001-future-garage-mix-april-jn8slcbnuqw.mp3",
      "url": "https://pub-777099b62b81412b8fa3b8a9046ae7ce.r2.dev/future-garage/future-garage-0001-future-garage-mix-april-jn8slcbnuqw.mp3",
      "sizeBytes": 171474212,
      "sha256": "ac7d120963905893c301d4cf1ac0691b9e6363ba8eaf72061ecd21c79436cb52",
      "mime": "audio/mpeg",
      "originalName": "FUTURE GARAGE MIX [APRIL] [jn8slcBNuQw].mp3",
      "durationSec": null
    },
    {
      "id": "1e1c0fcb34b12cf9",
      "title": null,
      "artist": null,
      "filename": "future-garage-0002-future-garage-mix-february-6clnrtrp9r4.mp3",
      "url": "https://pub-777099b62b81412b8fa3b8a9046ae7ce.r2.dev/future-garage/future-garage-0002-future-garage-mix-february-6clnrtrp9r4.mp3",
      "sizeBytes": 177534620,
      "sha256": "1e1c0fcb34b12cf9a324233736aafba4c3f59f3fa182b1ddf2a09fddd9ad765b",
      "mime": "audio/mpeg",
      "originalName": "FUTURE GARAGE MIX [FEBRUARY] [6CLnrTrP9r4].mp3",
      "durationSec": null
    },
    {
      "id": "57cadd7563aefc99",
      "title": null,
      "artist": null,
      "filename": "future-garage-0003-future-garage-mix-june-lskeugpbity.mp3",
      "url": "https://pub-777099b62b81412b8fa3b8a9046ae7ce.r2.dev/future-garage/future-garage-0003-future-garage-mix-june-lskeugpbity.mp3",
      "sizeBytes": 180112508,
      "sha256": "57cadd7563aefc99bc46df8109d58ff114b84a1863bc225786492687c29abd8a",
      "mime": "audio/mpeg",
      "originalName": "FUTURE GARAGE MIX [JUNE] [lSkeUGPbITY].mp3",
      "durationSec": null
    },
    {
      "id": "0ba408b1b6c3cfdf",
      "title": null,
      "artist": null,
      "filename": "future-garage-0004-future-garage-mix-march-owfzyo26nnu.mp3",
      "url": "https://pub-777099b62b81412b8fa3b8a9046ae7ce.r2.dev/future-garage/future-garage-0004-future-garage-mix-march-owfzyo26nnu.mp3",
      "sizeBytes": 163855220,
      "sha256": "0ba408b1b6c3cfdf55ca69816727b22c6ec98e82a807066e5e9ff7e36652df65",
      "mime": "audio/mpeg",
      "originalName": "FUTURE GARAGE MIX [MARCH] [oWfZyo26nNU].mp3",
      "durationSec": null
    },
    {
      "id": "2ecc843d75319c18",
      "title": null,
      "artist": null,
      "filename": "future-garage-0005-future-garage-mix-may-kbnczlocoxs.mp3",
      "url": "https://pub-777099b62b81412b8fa3b8a9046ae7ce.r2.dev/future-garage/future-garage-0005-future-garage-mix-may-kbnczlocoxs.mp3",
      "sizeBytes": 182981324,
      "sha256": "2ecc843d75319c18f4abf937ae6c12076e39e651918ef2d3241bae866cc17b88",
      "mime": "audio/mpeg",
      "originalName": "FUTURE GARAGE MIX [MAY] [KbnczlOCoXs].mp3",
      "durationSec": null
    },
    {
      "id": "76f3307d2e15b050",
      "title": null,
      "artist": null,
      "filename": "future-garage-0006-future-garage-mix-november-ii-zujr7albzpw.mp3",
      "url": "https://pub-777099b62b81412b8fa3b8a9046ae7ce.r2.dev/future-garage/future-garage-0006-future-garage-mix-november-ii-zujr7albzpw.mp3",
      "sizeBytes": 164474276,
      "sha256": "76f3307d2e15b05032333d06f19014bccfb44c2e9536d93d75474c623ce2d8e3",
      "mime": "audio/mpeg",
      "originalName": "FUTURE GARAGE MIX [NOVEMBER II] [ZUJr7albZpw].mp3",
      "durationSec": null
    },
    {
      "id": "6786c44b5280a02d",
      "title": null,
      "artist": null,
      "filename": "future-garage-0007-future-garage-mix-november-9qcdhrrvgl4.mp3",
      "url": "https://pub-777099b62b81412b8fa3b8a9046ae7ce.r2.dev/future-garage/future-garage-0007-future-garage-mix-november-9qcdhrrvgl4.mp3",
      "sizeBytes": 169897268,
      "sha256": "6786c44b5280a02d22053fad4002fbb426ed2ba23baa03f3f100b9f83a9c4ca8",
      "mime": "audio/mpeg",
      "originalName": "FUTURE GARAGE MIX [NOVEMBER] [9QCdhrRVGL4].mp3",
      "durationSec": null
    },
    {
      "id": "96edac7fdd740315",
      "title": null,
      "artist": null,
      "filename": "future-garage-0008-future-garage-mix-october-ii-cdpcia1c16i.mp3",
      "url": "https://pub-777099b62b81412b8fa3b8a9046ae7ce.r2.dev/future-garage/future-garage-0008-future-garage-mix-october-ii-cdpcia1c16i.mp3",
      "sizeBytes": 175743812,
      "sha256": "96edac7fdd7403155e6071b15b2b745d9f4ba247429bb85cc4908b08badd7025",
      "mime": "audio/mpeg",
      "originalName": "FUTURE GARAGE MIX [OCTOBER II] [cdPCiA1C16I].mp3",
      "durationSec": null
    },
    {
      "id": "e2aa6a90c1078a54",
      "title": null,
      "artist": null,
      "filename": "future-garage-0009-future-garage-mix-october-vzt93zoynos.mp3",
      "url": "https://pub-777099b62b81412b8fa3b8a9046ae7ce.r2.dev/future-garage/future-garage-0009-future-garage-mix-october-vzt93zoynos.mp3",
      "sizeBytes": 175837556,
      "sha256": "e2aa6a90c1078a54a45bebaf9b967ebf0e616d3530711ecbbc14ed3d89cd0147",
      "mime": "audio/mpeg",
      "originalName": "FUTURE GARAGE MIX [OCTOBER] [vZT93ZoYnos].mp3",
      "durationSec": null
    },
    {
      "id": "7aa493bb9bc1316e",
      "title": null,
      "artist": null,
      "filename": "future-garage-0010-future-garage-mix-september-6r-kzj13iti.mp3",
      "url": "https://pub-777099b62b81412b8fa3b8a9046ae7ce.r2.dev/future-garage/future-garage-0010-future-garage-mix-september-6r-kzj13iti.mp3",
      "sizeBytes": 178349276,
      "sha256": "7aa493bb9bc1316e2e9620a1390b373f8e61b7d43b878775d13b229fd62ec1bf",
      "mime": "audio/mpeg",
      "originalName": "FUTURE GARAGE MIX [SEPTEMBER] [6R_kZJ13ITI].mp3",
      "durationSec": null
    },
    {
      "id": "52191342f20175f8",
      "title": null,
      "artist": null,
      "filename": "future-garage-0011-future-garage-mix-summer-z3fd6xravgw.mp3",
      "url": "https://pub-777099b62b81412b8fa3b8a9046ae7ce.r2.dev/future-garage/future-garage-0011-future-garage-mix-summer-z3fd6xravgw.mp3",
      "sizeBytes": 181116044,
      "sha256": "52191342f20175f8e239848eb3378f6356901be48da5c5fbf105d7320e17c6c7",
      "mime": "audio/mpeg",
      "originalName": "FUTURE GARAGE MIX [SUMMER] [z3fD6XRavgw].mp3",
      "durationSec": null
    },
    {
      "id": "a15b1fd7d5b8ca1b",
      "title": null,
      "artist": null,
      "filename": "future-garage-0012-future-garagewave-mix-april-iii-tybc8dnxhre.mp3",
      "url": "https://pub-777099b62b81412b8fa3b8a9046ae7ce.r2.dev/future-garage/future-garage-0012-future-garagewave-mix-april-iii-tybc8dnxhre.mp3",
      "sizeBytes": 191228420,
      "sha256": "a15b1fd7d5b8ca1b255c920c71e5d3fcd89a700ae49f4ce76b624dd67e2acba5",
      "mime": "audio/mpeg",
      "originalName": "FUTURE GARAGE⧸WAVE MIX [APRIL III] [tYBc8DNxHRE].mp3",
      "durationSec": null
    },
    {
      "id": "cc87637912292d37",
      "title": null,
      "artist": null,
      "filename": "future-garage-0013-future-garagewave-mix-april-iv-grumo73fxcc.mp3",
      "url": "https://pub-777099b62b81412b8fa3b8a9046ae7ce.r2.dev/future-garage/future-garage-0013-future-garagewave-mix-april-iv-grumo73fxcc.mp3",
      "sizeBytes": 192124964,
      "sha256": "cc87637912292d37964d6bf66e7f610c9ef457eab71227b98d167fee18fc68de",
      "mime": "audio/mpeg",
      "originalName": "FUTURE GARAGE⧸WAVE MIX [APRIL IV] [grUMo73fXcc].mp3",
      "durationSec": null
    },
    {
      "id": "867b326e0435f7c0",
      "title": null,
      "artist": null,
      "filename": "future-garage-0014-future-garagewave-mix-april-v-hfob2g49bmg.mp3",
      "url": "https://pub-777099b62b81412b8fa3b8a9046ae7ce.r2.dev/future-garage/future-garage-0014-future-garagewave-mix-april-v-hfob2g49bmg.mp3",
      "sizeBytes": 183923156,
      "sha256": "867b326e0435f7c038853b39152c06aeae5a44b7c128a88d47fd3622157a0f5f",
      "mime": "audio/mpeg",
      "originalName": "FUTURE GARAGE⧸WAVE MIX [APRIL V] [Hfob2G49Bmg].mp3",
      "durationSec": null
    },
    {
      "id": "b93c89920ba2ac8c",
      "title": null,
      "artist": null,
      "filename": "future-garage-0015-future-garagewave-mix-april-vi-hz5roibmj9c.mp3",
      "url": "https://pub-777099b62b81412b8fa3b8a9046ae7ce.r2.dev/future-garage/future-garage-0015-future-garagewave-mix-april-vi-hz5roibmj9c.mp3",
      "sizeBytes": 171064316,
      "sha256": "b93c89920ba2ac8c3de36816d40af587342628ace078c44923b837a6952b4685",
      "mime": "audio/mpeg",
      "originalName": "FUTURE GARAGE⧸WAVE MIX [APRIL VI] [Hz5ROiBMJ9c].mp3",
      "durationSec": null
    },
    {
      "id": "9d0d4f7dc664b9f1",
      "title": null,
      "artist": null,
      "filename": "future-garage-0016-future-garagewave-mix-april-vii-s4sdq3s6msi.mp3",
      "url": "https://pub-777099b62b81412b8fa3b8a9046ae7ce.r2.dev/future-garage/future-garage-0016-future-garagewave-mix-april-vii-s4sdq3s6msi.mp3",
      "sizeBytes": 179644292,
      "sha256": "9d0d4f7dc664b9f1de4c73c54f5b3110a19d1617082557ab46c379b56eadbca9",
      "mime": "audio/mpeg",
      "originalName": "FUTURE GARAGE⧸WAVE MIX [APRIL VII] [s4Sdq3s6MSI].mp3",
      "durationSec": null
    },
    {
      "id": "dbbbdbd2bca5ab11",
      "title": null,
      "artist": null,
      "filename": "future-garage-0017-future-garagewave-mix-august-iii-pfz-tzqi5du.mp3",
      "url": "https://pub-777099b62b81412b8fa3b8a9046ae7ce.r2.dev/future-garage/future-garage-0017-future-garagewave-mix-august-iii-pfz-tzqi5du.mp3",
      "sizeBytes": 225787076,
      "sha256": "dbbbdbd2bca5ab112b906add73515cee9ec83920ad9fee46dcf343b6b1472cd5",
      "mime": "audio/mpeg",
      "originalName": "FUTURE GARAGE⧸WAVE MIX [AUGUST III] [PFz-tzqI5DU].mp3",
      "durationSec": null
    },
    {
      "id": "58013b330e174901",
      "title": null,
      "artist": null,
      "filename": "future-garage-0018-future-garagewave-mix-august-4v-ynvd1vpa.mp3",